If the blockade you have imposed upon us is not ended right now, the next message you have from the \x82 Empire will be one of war.	若你對我們施加的封鎖不立刻結束,你從 \x82 帝國收到的下一則訊息將是宣戰。	封鎖警告
Emperor \x83 commands you to remove the blockade.	\x83 皇帝命令你撤除封鎖。	封鎖警告
You will find that if you do not remove your blockade around the \x82 system, you will soon be at war.	你會發現,若你不撤除對 \x82 星系的封鎖,你很快就會陷入戰爭。	封鎖警告
I bear a message from the great \x82 Emperor: cancel your blockade or we will declare war on the \x81 people.	我帶來偉大 \x82 皇帝的訊息:取消你的封鎖,否則我們將向 \x81 人民宣戰。	封鎖警告
Your economic expansion is getting out of hand, Emperor \x80. Slow down, or we will be forced to go to war to protect our interests.	你的經濟擴張正逐漸失控,\x80 皇帝。放慢腳步,否則我們將被迫開戰以保護我們的利益。	經濟警告
Don't be a power hungry fool, \x80. We will be forced to go to war with you if you continue to threaten our economic growth by hoarding money and resources.	別做個貪權的蠢貨,\x80。若你繼續囤積金錢與資源、威脅我們的經濟成長,我們將被迫與你開戰。	經濟警告
You are grabbing economic power quickly and recklessly, \x80. Be careful, or your \x82 friends will become enemies.	你正迅速而魯莽地攫取經濟力量,\x80。當心,否則你的 \x82 朋友將變成敵人。	經濟警告
You are growing over ambitious, Emperor \x80. We warn you not to upset the balance of the galactic economy, or we will declare war.	你變得野心過大,\x80 皇帝。我們警告你別擾亂銀河經濟的平衡,否則我們將宣戰。	經濟警告
So, trying to throw your weight around a little, eh? You think voting against us in the Council gains you a little attention? Rethink that strategy, or we may have to beat a little sense into you.	怎麼,想耍點威風?你以為在議會投票反對我們能博得一點關注?重新想想這個策略,否則我們可能得好好教訓你一頓,讓你清醒點。	投票威脅
If you are not for us, \x80, you are against us. We will not hesitate to destroy you if you continue to make yourself an enemy of the \x82 Empire.	若你不站在我們這邊,\x80,你就是與我們為敵。若你繼續與 \x82 帝國為敵,我們將毫不猶豫地摧毀你。	投票威脅
Just a misunderstanding, yes? You meant to vote for the \x82 Emperor but made a mistake. We understand, and give you one more chance to correct your vote at the next meeting. Otherwise, war!	只是個誤會,是吧?你本想投給 \x82 皇帝卻投錯了。我們理解,並在下次會議給你一次改正選票的機會。否則,開戰!	投票威脅
The \x82 ruler needs your vote, \x80. Next time, vote for us, and you will see what valuable friends we can be. Vote against us, and you will see what dreaded enemies we make.	\x82 統治者需要你的一票,\x80。下次投給我們,你將見識我們能成為多麼寶貴的朋友。投票反對我們,你將見識我們能成為多麼可怕的敵人。	投票威脅
The \x82 Emperor is a little, shall we say, disappointed with your last vote, \x80. Don't displease us again, or there will be grave consequences.	\x82 皇帝對你上次的投票,可以說是,有點失望,\x80。別再惹怒我們,否則後果不堪設想。	投票威脅
You voted incorrectly, \x80. You were supposed to vote for the \x82s, remember? Get it right next time, or you will find yourself at war.	你投錯了,\x80。你本該投給 \x82 人,記得嗎?下次投對,否則你將陷入戰爭。	投票威脅
The \x82 Emperor is the only fit leader for the council. Next time, vote accordingly, or the price will be your destruction.	\x82 皇帝是議會唯一適任的領袖。下次照此投票,否則代價將是你的毀滅。	投票威脅
The \x82 Empire is aware of your petty espionage attempts, \x80. We will break the \x8a unless you give me a gift: \x95.	\x82 帝國知道你那些微不足道的間諜企圖,\x80。除非你送我一份禮物,否則我們將撕毀 \x8a:\x95。	勒索
Emperor \x83 has two demands - that you remove your spies from our territory, and that you give us: \x95. Otherwise, the \x8a is gone.	\x83 皇帝有兩項要求——你撤走在我們領土的間諜,並給我們:\x95。否則,\x8a 就此作廢。	勒索
We are aware of the malicious activity of \x81 saboteurs in our territory, \x80. We demand repayment, or we will cancel all treaties. Give us: \x95.	我們知道 \x81 破壞者在我們領土的惡意活動,\x80。我們要求賠償,否則將取消所有條約。給我們:\x95。	勒索
We will break the current \x8a unless you cease the sabotage attacks and give us: \x95.	除非你停止破壞攻擊並給我們:\x95,否則我們將撕毀現行的 \x8a。	勒索
The increasing number of your ships in the \x93 system makes us nervous. Pacify us with a gift, or you will find all treaties called off. We want: \x95.	你在 \x93 星系日益增多的船艦令我們不安。以一份禮物安撫我們,否則你將發現所有條約作廢。我們要:\x95。	勒索
We will break the \x8a unless you remove your ships from \x93 and give us: \x95.	除非你把船艦撤離 \x93 並給我們:\x95,否則我們將撕毀 \x8a。	勒索
Your use of biological weaponry has upset us, Emperor \x80. All \x81 treaties will be canceled unless you give us something to help us forget: \x95.	你使用生化武器令我們不快,\x80 皇帝。除非你給我們一些能讓我們遺忘的東西,否則所有 \x81 條約都將被取消:\x95。	勒索
We will cancel the current \x81/\x82\x8a unless you give us: \x95. This will help us forget your use of hideous bio-weaponry.	除非你給我們:\x95,否則我們將取消現行的 \x81/\x82\x8a。這將幫助我們遺忘你使用可怕生化武器的事。	勒索
Your senseless blockade of our system is jeopardizing our treaties, \x80. We will end all relations with you unless you give us: \x95.	你對我們星系無謂的封鎖正危及我們的條約,\x80。除非你給我們:\x95,否則我們將終止與你的一切關係。	勒索
Your recent economic expansion has not gone unnoticed. Grand Emperor \x83 will break all treaties unless you pay us with: \x95!	你近來的經濟擴張並未被忽視。除非你以 \x95 償付我們,否則大皇帝 \x83 將撕毀所有條約!	勒索
We do not appreciate your recent economic expansion, \x80. We demand a gift, or the \x8a will be repealed: \x95.	我們不欣賞你近來的經濟擴張,\x80。我們要求一份禮物,否則 \x8a 將被廢除:\x95。	勒索
Your decision to not vote for Emperor \x83 has angered the \x82 Empire. Give us: \x95, or you will find all treaties are off!	你決定不投票給 \x83 皇帝,激怒了 \x82 帝國。給我們:\x95,否則你將發現所有條約作廢!	勒索
The \x8a required you to vote for Emperor \x83. Now you must give us something to forget this indiscretion, or the treaty is off: \x95.	\x8a 要求你投票給 \x83 皇帝。如今你必須給我們一些東西來遺忘這次失禮,否則條約作廢:\x95。	勒索
You dare go against the wishes of the great Emperor \x83? You will pay dearly for this!	你膽敢違背偉大 \x83 皇帝的意願?你將為此付出慘痛代價!	威脅
Do not think that you can get away with this insolence, \x80!	別以為你能就這樣逃過這番傲慢,\x80!	威脅
You will pay for that decision, foolish \x81 dog!	你將為那個決定付出代價,愚蠢的 \x81 走狗!	威脅
